{
  "$schema": "urn:valle-design:schema:cad-plan-benchmark-evidence:v1",
  "schemaVersion": 1,
  "benchmarkId": "valle-design-cad-plan-real-v1",
  "startedAt": "2026-08-17T06:49:27.542Z",
  "finishedAt": "2026-08-17T06:49:48.326Z",
  "enforcement": "report-only",
  "enforcementRationale": "Perfil nuevo: la evidencia se publica y el presupuesto se fija en spec local (plan-budget.spec.ts), no en este script. Los presupuestos están calibrados para esta máquina de desarrollo, NO para el runner de CI.",
  "verdict": {
    "profileId": "plano-real-20k",
    "passed": true,
    "violations": []
  },
  "environment": {
    "node": "v22.18.0",
    "v8": "12.4.254.21-node.27",
    "platform": "win32",
    "architecture": "x64",
    "osType": "Windows_NT",
    "osRelease": "10.0.26200",
    "cpuModel": "AMD Ryzen 5 5500U with Radeon Graphics         ",
    "logicalCpuCount": 12,
    "availableParallelism": 12,
    "totalMemoryBytes": 7896625152,
    "freeMemoryBytesAtStart": 2358042624,
    "heapLimitBytes": 4345298944,
    "declaredMachine": "AMD Ryzen 5 5500U (6 núcleos físicos / 12 hilos), 7,4 GB de RAM utilizable, Windows 11, portátil de desarrollo con carga vecina"
  },
  "corpus": {
    "mix": "plano-real",
    "title": "Plano real de despacho: muros por caras, cadenas de cotas, acabados y bloques repetidos",
    "stresses": "densidad de segmentos cortos por celda, selección por ventana, OSNAP y reconstrucción tras editar",
    "entities": 20000,
    "entityMix": {
      "line": 5800,
      "polyline": 3000,
      "circle": 1200,
      "arc": 1200,
      "hatch": 1400,
      "mtext": 2000,
      "dimension": 2600,
      "insert": 2800
    },
    "cellSizeMm": 700,
    "layers": 11,
    "blockDefinitions": 4,
    "bounds": {
      "minX": -350,
      "minY": -350,
      "maxX": 99480.367,
      "maxY": 99050
    },
    "sha256": "b91c346856bf914dc0ed51b8b10a3382a10064923bad419dd17c05bd214b44ef",
    "compositionRationale": "Modelo declarado, no censo de archivos reales. Derivación completa y supuestos en la cabecera de src/lib/cad/benchmark/corpus-plano-real-builders.ts."
  },
  "scenario": {
    "panStops": 12,
    "initialPixelsPerUnit": 0.016027187398800206,
    "panPixelsPerUnit": 0.06410874959520083,
    "zoomPixelsPerUnit": 0.2564349983808033,
    "selectionQueries": 200,
    "selectionWindowSideMm": 2100,
    "snapQueries": 200,
    "snapTolerancePx": 12,
    "snapApertureMm": 46.795,
    "editGroups": 40,
    "repeatsPerMeasurement": 3,
    "published": "mediana entre corridas"
  },
  "measurements": {
    "viewport": {
      "openMs": 1237.425,
      "framesToOpen": 163,
      "pan": {
        "p50Ms": 4.906,
        "p95Ms": 8.084,
        "maxMs": 9.469,
        "samples": 48,
        "samplesMs": [
          5.707,
          5.237,
          5.823,
          6.704,
          4.522,
          4.384,
          7.348,
          5.432,
          4.765,
          5.707,
          4.811,
          6.842,
          4.912,
          2.737,
          0.01,
          6.27,
          4.956,
          6.666,
          1.14,
          4.906,
          4.346,
          6.554,
          3.724,
          6.644,
          4.498,
          4.017,
          1.278,
          4.969,
          5.07,
          5.202,
          0.845,
          0.009,
          8.084,
          9.469,
          4.504,
          2.013,
          7.273,
          4.291,
          8.225,
          1.633,
          4.332,
          5.289,
          4.418,
          2.806,
          7.983,
          6.652,
          2.521,
          1.723
        ]
      },
      "zoom": {
        "p50Ms": 4.4,
        "p95Ms": 5.599,
        "maxMs": 5.599,
        "samples": 4,
        "samplesMs": [
          4.714,
          5.599,
          4.4,
          0.706
        ]
      },
      "zoomSettleMs": 15.559,
      "visibleAtRest": 85,
      "detailedAtRest": 85,
      "segmentsAtRest": 8551
    },
    "selectionIndexBuildMs": 512.518,
    "windowSelection": {
      "mode": "window",
      "latency": {
        "p50Ms": 0.184,
        "p95Ms": 0.324,
        "maxMs": 3.673,
        "samples": 200,
        "samplesMs": [
          0.201,
          0.163,
          0.127,
          0.127,
          0.137,
          0.138,
          0.185,
          0.223,
          0.14,
          0.114,
          0.362,
          0.243,
          0.278,
          0.266,
          0.259,
          0.131,
          0.215,
          0.331,
          0.229,
          0.217,
          0.236,
          0.24,
          0.221,
          0.237,
          0.252,
          0.187,
          0.195,
          0.175,
          0.308,
          0.202,
          0.243,
          0.219,
          0.195,
          0.282,
          0.242,
          0.324,
          0.279,
          3.673,
          0.153,
          0.13,
          0.151,
          0.223,
          0.231,
          0.158,
          0.113,
          0.104,
          0.113,
          0.173,
          0.167,
          0.173,
          0.188,
          0.123,
          0.145,
          0.172,
          0.098,
          0.139,
          0.126,
          0.141,
          0.117,
          0.157,
          0.198,
          0.095,
          0.095,
          0.309,
          0.133,
          0.117,
          0.123,
          0.115,
          0.199,
          0.166,
          0.087,
          0.133,
          0.11,
          0.136,
          0.138,
          0.117,
          0.097,
          0.141,
          0.194,
          0.176,
          0.146,
          0.13,
          0.187,
          0.135,
          0.107,
          0.112,
          0.163,
          0.138,
          0.231,
          0.267,
          0.258,
          0.227,
          0.264,
          0.247,
          0.196,
          0.21,
          0.199,
          0.265,
          0.465,
          0.382,
          0.401,
          0.233,
          0.222,
          0.265,
          0.272,
          0.138,
          0.216,
          0.205,
          0.185,
          0.239,
          0.428,
          0.259,
          0.172,
          0.121,
          0.149,
          0.134,
          0.091,
          0.175,
          0.131,
          0.139,
          0.175,
          0.145,
          0.13,
          0.104,
          0.344,
          0.144,
          0.135,
          0.145,
          0.133,
          0.131,
          0.179,
          0.114,
          0.124,
          0.12,
          0.178,
          0.169,
          0.363,
          0.194,
          0.199,
          0.205,
          0.212,
          0.194,
          0.202,
          0.211,
          0.23,
          0.181,
          0.206,
          0.21,
          0.143,
          0.231,
          0.279,
          0.287,
          0.155,
          0.133,
          0.144,
          0.219,
          0.347,
          0.175,
          0.165,
          0.155,
          0.2,
          0.194,
          0.153,
          0.202,
          0.14,
          0.126,
          0.287,
          0.158,
          0.215,
          0.133,
          0.18,
          0.211,
          0.179,
          0.189,
          0.232,
          0.176,
          0.215,
          0.275,
          0.173,
          0.189,
          0.174,
          0.236,
          0.233,
          0.162,
          0.11,
          0.199,
          0.198,
          0.226,
          0.175,
          0.237,
          0.205,
          0.224,
          0.193,
          0.172,
          0.184,
          0.236,
          0.211,
          0.321,
          0.18,
          0.146
        ]
      },
      "hitsP50": 7,
      "hitsMax": 10,
      "hitsTotal": 1395,
      "windowSideMm": 2100
    },
    "crossingSelection": {
      "mode": "crossing",
      "latency": {
        "p50Ms": 0.172,
        "p95Ms": 0.286,
        "maxMs": 3.99,
        "samples": 200,
        "samplesMs": [
          0.209,
          0.157,
          0.136,
          0.115,
          0.123,
          0.113,
          0.16,
          0.133,
          0.115,
          0.081,
          0.101,
          0.111,
          0.126,
          0.12,
          0.131,
          0.063,
          0.103,
          0.128,
          0.102,
          0.106,
          0.126,
          0.131,
          0.149,
          0.127,
          0.08,
          0.082,
          0.075,
          0.085,
          0.171,
          0.109,
          0.13,
          0.107,
          0.101,
          0.15,
          0.13,
          0.123,
          0.117,
          0.145,
          0.103,
          0.094,
          0.132,
          0.122,
          0.121,
          0.095,
          0.086,
          0.084,
          0.083,
          0.148,
          0.143,
          0.12,
          0.098,
          0.097,
          0.125,
          0.147,
          0.081,
          0.12,
          0.11,
          0.156,
          0.123,
          0.14,
          0.119,
          0.089,
          0.121,
          0.126,
          0.127,
          0.183,
          0.173,
          0.115,
          0.263,
          0.217,
          0.113,
          0.227,
          0.153,
          0.182,
          0.212,
          0.144,
          0.089,
          0.134,
          0.187,
          0.247,
          0.204,
          0.128,
          0.131,
          0.153,
          0.095,
          0.107,
          3.99,
          0.311,
          0.264,
          0.283,
          0.213,
          0.227,
          0.266,
          0.321,
          0.195,
          0.189,
          0.202,
          0.241,
          0.245,
          0.202,
          0.2,
          0.191,
          0.237,
          0.249,
          0.254,
          0.166,
          0.204,
          0.12,
          0.154,
          0.222,
          0.342,
          0.202,
          0.295,
          0.125,
          0.203,
          0.188,
          0.119,
          0.264,
          0.16,
          0.196,
          0.251,
          0.158,
          0.383,
          0.169,
          0.132,
          0.223,
          0.23,
          0.25,